{
  "schema_version": "1.0.0",
  "record_type": "RELEASE_CANDIDATE_PUBLICATION_DRY_RUN_ADMISSION_BLOCKERS_v1",
  "checklist_id": "release-candidate-package-publish-dry-run-admission-blockers-v1",
  "checklist_version": "v1",
  "candidate_id": "release_candidate_package_publish_dry_run_v1",
  "candidate_type": "dry_run",
  "checklist_status": "static_checklist_valid_blocked",
  "admission_status": "unadmitted",
  "approval_review_ready": false,
  "dry_run_admitted": false,
  "receipt_issued": false,
  "publication_admitted": false,
  "real_execution_admitted": false,
  "production_ready_claimed": false,
  "generated_from_static_artifacts_only": true,
  "source_artifacts": {
    "candidate_matrix_ref": "examples/execution-admission/execution_admission_candidate_matrix_v1.json",
    "preflight_contracts_ref": "examples/execution-admission/execution_admission_preflight_contracts_v1.json",
    "preflight_proof_packages_ref": "examples/execution-admission/execution_admission_preflight_proof_packages_v1.json",
    "readiness_rollup_ref": "examples/execution-admission/execution_admission_readiness_rollup_v1.json",
    "dry_run_plan_ref": "examples/execution-admission/release_candidate_package_publish_dry_run_plan_v1.json",
    "dry_run_receipt_contract_ref": "examples/execution-admission/release_candidate_package_publish_dry_run_receipt_contract_v1.json",
    "blocked_unissued_receipt_ref": "examples/execution-admission/release_candidate_package_publish_dry_run_receipt_blocked_v1.json",
    "production_readiness_report_ref": "examples/production-readiness-report/max_biped_v1_production_readiness_report_pass.json",
    "noop_receipt_status_ref": "examples/execution-admission/release_candidate_package_receipt_noop_execution_admission_decision_approved.json"
  },
  "source_artifact_validation_status": {
    "candidate_matrix_status": "pass",
    "preflight_contracts_status": "pass",
    "preflight_proof_packages_status": "pass",
    "readiness_rollup_status": "pass",
    "dry_run_plan_status": "pass",
    "dry_run_receipt_contract_status": "pass",
    "blocked_unissued_receipt_status": "pass",
    "production_readiness_status": "pass",
    "noop_receipt_status": "pass"
  },
  "prerequisite_checklist": {
    "candidate_matrix_entry_present": true,
    "preflight_contract_present": true,
    "preflight_proof_package_present": true,
    "readiness_rollup_present": true,
    "dry_run_plan_present": true,
    "dry_run_receipt_contract_present": true,
    "blocked_unissued_receipt_example_present": true,
    "production_readiness_report_present": true,
    "noop_receipt_status_present": true,
    "source_artifact_validations_pass": true,
    "approval_decision_present": false,
    "dry_run_runner_admitted": false,
    "dry_run_executed": false,
    "dry_run_receipt_issued": false,
    "rollback_cleanup_evidence_present": false,
    "publication_surfaces_blocked": true,
    "execution_surfaces_blocked": true,
    "production_ready_claimed": false
  },
  "admission_blockers": [
    "missing_approval_decision",
    "dry_run_not_admitted",
    "dry_run_not_executed",
    "receipt_not_issued",
    "rollback_cleanup_evidence_missing",
    "publication_surfaces_blocked_by_policy"
  ],
  "approval_blockers": [
    "missing_approval_decision",
    "approval_review_not_ready",
    "operator_approval_packet_template_only_not_approval_decision"
  ],
  "evidence_blockers": [
    "dry_run_not_executed",
    "required_dry_run_evidence_not_present",
    "rollback_cleanup_evidence_missing"
  ],
  "receipt_blockers": [
    "receipt_not_issued",
    "receipt_emission_requires_admission",
    "receipt_contract_is_static_only"
  ],
  "rollback_or_cleanup_blockers": [
    "rollback_cleanup_evidence_missing",
    "no_dry_run_noop_cleanup_receipt"
  ],
  "safety_blockers": [
    "publication_surfaces_blocked_by_policy",
    "execution_surfaces_blocked_by_policy",
    "cache_live_db_access_blocked_by_policy",
    "production_engine_write_blocked_by_policy",
    "authoritative_id_claims_blocked_by_policy"
  ],
  "publication_blockers": [
    "publication_surfaces_blocked_by_policy",
    "publication_admission_not_granted"
  ],
  "execution_blockers": [
    "dry_run_not_admitted",
    "execution_surfaces_blocked_by_policy",
    "real_execution_admission_not_granted"
  ],
  "ready_to_request_approval": false,
  "approval_phrase_required": "APPROVE EXECUTION ADMISSION release_candidate_package_publish_dry_run_v1",
  "approval_decision_reference": null,
  "safest_next_action": "Keep candidate unadmitted and build an operator approval packet template while all blockers remain active and machine-verified.",
  "unsafe_claims_detected": false,
  "claim_status": {
    "source_uuid_status": "not_authoritative",
    "asset_id_status": "not_authoritative",
    "product_id_status": "not_authoritative"
  },
  "safety_notes": [
    "This checklist is static status only and does not approve or admit dry-run execution.",
    "This checklist does not issue a dry-run receipt and keeps receipt_issued=false.",
    "This checklist preserves blocked execution/publication surfaces and production readiness remains unclaimed."
  ]
}
